;Unnamed: 0;created_at;favorite_count;id_str;is_retweet;retweet_count;source;text;sentiment;topic_words
2374;2374;2015-02-23 18:07:03;3319.0;569921393426432000;0.0;3154.0;"<a href=""http://twitter.com"" rel=""nofollow"">Twitter Web Client</a>";Only two months on the job, the new Congress is already threatening a partial government shutdown. #EnoughAlready http://t.co/8OX0MCxbzc;-0.5267;['nation', 'life', 'someone']
2375;2375;2015-02-22 01:18:25;1577.0;569305172951863296;0.0;1154.0;"<a href=""http://twitter.com"" rel=""nofollow"">Twitter Web Client</a>";In the weekly address, the President discusses opening new markets to grow the economy and support good-paying jobs: http://t.co/iQPq7eWjfe;0.4019;['nation', 'law', 'SOTU']
2377;2377;2015-02-20 18:29:10;1265.0;568839795004145664;0.0;1085.0;"<a href=""http://twitter.com"" rel=""nofollow"">Twitter Web Client</a>";Here are eight ways #Obamacare has proved the critics wrong: http://t.co/kjxbQXoraW (h/t @voxdotcom);-0.6486;['President', 'SOTU', 'generosity']
2378;2378;2015-02-19 23:05:51;1872.0;568547038532481024;0.0;1082.0;"<a href=""http://twitter.com"" rel=""nofollow"">Twitter Web Client</a>";It's more than health insurance—it's peace of mind. http://t.co/nBIJv0evNk;0.5423;['odds', 'people', 'things']
2379;2379;2015-02-19 20:00:14;1105.0;568500324698361860;0.0;548.0;"<a href=""http://twitter.com"" rel=""nofollow"">Twitter Web Client</a>";LIVE: The President announces new national monuments and an initiative to protect the nation's unique outdoor spaces. http://t.co/KyWNB87mKy;0.3818;['SOTU', 'cynicism', 'cynics']
2380;2380;2015-02-19 16:42:58;1290.0;568450681373200385;0.0;715.0;"<a href=""http://twitter.com"" rel=""nofollow"">Twitter Web Client</a>";"""Trade has an important role to play in supporting good-paying, middle-class jobs in the U.S."" —President Obama http://t.co/521E9s0SB4";0.7269;['President', 'SOTU', 'example']
2381;2381;2015-02-18 23:39:47;3345.0;568193189699403777;0.0;2941.0;"<a href=""http://twitter.com"" rel=""nofollow"">Twitter Web Client</a>";Too many lawmakers still deny the science of climate change. Call them out now: http://t.co/qlquFqhsA6 #ActOnClimate http://t.co/MbzTx9Wz3E;-0.34;['efforts', 'SOTU', 'ActOnClimate']
2382;2382;2015-02-18 15:43:47;2100.0;568073400624631808;0.0;1164.0;"<a href=""http://twitter.com"" rel=""nofollow"">Twitter Web Client</a>";The Affordable Care Act is helping millions of families—we can't go back now. http://t.co/OWOxJreB2m;0.6597;['years', 'record', 'ActOnClimate']
2383;2383;2015-02-18 00:27:48;0.0;567842886013739008;0.0;1715.0;"<a href=""http://twitter.com"" rel=""nofollow"">Twitter Web Client</a>";"RT @WhiteHouse: BREAKING: About 11.4 million Americans are signed up for private health coverage. #11MillionAndCounting #ACAWorks
https://t…";0.0;['climate', 'change', 'generations']
2384;2384;2015-02-17 19:30:10;0.0;567767981497655297;0.0;516.0;"<a href=""http://twitter.com"" rel=""nofollow"">Twitter Web Client</a>";"RT @FLOTUS: Look who's helping kids #eatbrighter:
@BillyEichner ✓
@BigBird ✓
@FunnyOrDie ✓
@PMA ✓
The First Lady ✓
http://t.co/YuTbrYlTx1 #…";0.29600000000000004;['ActOnClimate', 'SOTU', 'science']
2385;2385;2015-02-16 01:07:38;1537.0;567128132474662912;0.0;819.0;"<a href=""http://twitter.com"" rel=""nofollow"">Twitter Web Client</a>";The deadline is here. Go #GetCoveredNow: http://t.co/xTRj74V0N6 http://t.co/ykQVuz3NC8;0.0;['SOTU', 'something', 'time']
2386;2386;2015-02-15 17:52:04;1299.0;567018521901932544;0.0;672.0;"<a href=""http://twitter.com"" rel=""nofollow"">Twitter Web Client</a>";Last call for health insurance this year: http://t.co/1jOkVIuE0L #GetCoveredNow;0.0;['jobs.…', 'kinds', 'science']
2387;2387;2015-02-14 23:32:47;3692.0;566741877668343809;0.0;2771.0;"<a href=""http://twitter.com"" rel=""nofollow"">Twitter Web Client</a>";"""Nothing will determine our success as a nation in the 21st century more than how well we educate our kids."" http://t.co/LD1A7FBBDH";0.7239;['t.co/gjhKy292KG', 'WhiteHouse', 'tax']
2389;2389;2015-02-14 16:49:34;1422.0;566640402208681987;0.0;672.0;"<a href=""http://twitter.com"" rel=""nofollow"">Twitter Web Client</a>";In the weekly address, the President lays out his plan to ensure more kids graduate from school ready for the future: http://t.co/dMEJG0KJ6Y;0.6249;['research', 'issues', 's']
2390;2390;2015-02-14 00:19:39;1315.0;566391284185591808;0.0;540.0;"<a href=""http://twitter.com"" rel=""nofollow"">Twitter Web Client</a>";Just like your favorite romantic comedies—but with benefits: http://t.co/60fxgyjsry #GetCoveredNow;0.8689;['research', 'development', 'science']
2391;2391;2015-02-13 21:53:59;1197.0;566354626148974592;0.0;553.0;"<a href=""http://twitter.com"" rel=""nofollow"">Twitter Web Client</a>";The United States can make real progress on climate change. Read more from @Podesta44: http://t.co/WZArcVM0IN;0.6808;['plan', 'pass', 'times']
2392;2392;2015-02-13 19:34:07;990.0;566319423921745920;0.0;457.0;"<a href=""http://twitter.com"" rel=""nofollow"">Twitter Web Client</a>";LIVE: President Obama is speaking at the White House #CyberSummit at @Stanford. http://t.co/CXo6EhiiVk;0.0;['right', 'job', 'someone']
2393;2393;2015-02-13 17:01:08;1239.0;566280927194529792;0.0;662.0;"<a href=""http://twitter.com"" rel=""nofollow"">Twitter Web Client</a>";Make sure your loved ones are covered: http://t.co/SWjS2289uU #GetCoveredNow http://t.co/xGHVrBHovH;0.7351;['opportunity', 'home', 'dream']
2396;2396;2015-02-12 18:33:42;2285.0;565941832345853952;0.0;1568.0;"<a href=""http://twitter.com"" rel=""nofollow"">Twitter Web Client</a>";No more games—Congress should stop the political posturing and make progress on immigration. #EnoughAlready http://t.co/LH2npSuNR4;-0.2177;['cost', 'community', 'plan']
2398;2398;2015-02-11 20:38:27;1228.0;565610838372122627;0.0;710.0;"<a href=""http://twitter.com"" rel=""nofollow"">Twitter Web Client</a>";Happening now: President Obama discusses taking action against ISIL. http://t.co/HarnB4wWMb;0.0;['RaiseTheWage', 'family', 'year']
2399;2399;2015-02-11 18:33:38;1211.0;565579430912090113;0.0;564.0;"<a href=""http://twitter.com"" rel=""nofollow"">Twitter Web Client</a>";The President discusses the importance of health care and marriage equality progress in his interview with @BuzzFeed: http://t.co/EGKNHMWp8J;0.8176;['LeadOnLeave', 'pay', 'time']
2400;2400;2015-02-11 17:14:46;1002.0;565559582718574592;0.0;474.0;"<a href=""http://twitter.com"" rel=""nofollow"">Twitter Web Client</a>";Of all the things you do today, getting covered before the enrollment deadline could be the most crucial: http://t.co/3uAVMQWgm4 #GetCovered;0.0;['opportunity', 'days', 'sick']
2401;2401;2015-02-10 21:13:44;1218.0;565257332469534722;0.0;581.0;"<a href=""http://twitter.com"" rel=""nofollow"">Twitter Web Client</a>";It's the final countdown: Only five days left in the enrollment period. #GetCovered now. http://t.co/iToBPhVVmy http://t.co/hYgwhVrPa7;0.0;['guarantee', 'doesn', 'maternity']
2403;2403;2015-02-09 23:01:59;1531.0;564922184208900096;0.0;629.0;"<a href=""http://twitter.com"" rel=""nofollow"">Twitter Web Client</a>";Joshua got covered so that he could stay healthy—without worrying about expensive premiums. http://t.co/RSnykzs9Xf;-0.34;['issue', 'must-have', 't.co/…']
2404;2404;2015-02-09 20:46:48;1288.0;564888167384223744;0.0;757.0;"<a href=""http://twitter.com"" rel=""nofollow"">Twitter Web Client</a>";Repealing the Affordable Care Act would mean millions of Americans could lose their health insurance: http://t.co/LnUNqKlZSw;0.128;['secure', 'economics', 'SOTU']
2405;2405;2015-02-09 19:06:44;1061.0;564862983419867136;0.0;439.0;"<a href=""http://twitter.com"" rel=""nofollow"">Twitter Web Client</a>";President Obama sat down with @voxdotcom to discuss health care, the economy, and America's position in the world: http://t.co/5JIJ23wiWH;0.4939;['SOTU', 'country', 'everyone']
2406;2406;2015-02-09 02:54:29;7323.0;564618307278761985;0.0;6697.0;"<a href=""http://twitter.com"" rel=""nofollow"">Twitter Web Client</a>";Watch the message that aired tonight during the #Grammys from President Obama: #ItsOnUs to stop sexual assault. http://t.co/xytAN7mSyW;-0.7184;['security', 'health', 't.co/…']
2407;2407;2015-02-07 19:00:02;1263.0;564136521070948352;0.0;559.0;"<a href=""http://twitter.com"" rel=""nofollow"">Twitter Web Client</a>";Watch: In the weekly address, President Obama highlights the country's economic progress. http://t.co/r7fV6DJL2p;0.4215;['everyone', 'SOTU', 'Congress']
2408;2408;2015-02-06 22:25:00;1255.0;563825714596556800;0.0;521.0;"<a href=""http://twitter.com"" rel=""nofollow"">Twitter Web Client</a>";Watch: These people are why the Affordable Care Act matters. http://t.co/dousOukeLQ;0.5106;['link', 'Tonight', 'opportunity']
2409;2409;2015-02-06 20:01:28;3007.0;563789592621371392;0.0;1672.0;"<a href=""http://twitter.com"" rel=""nofollow"">Twitter Web Client</a>";"""Let's roll up our sleeves, work together, and try to get something done."" —President Obama";0.0;['President', 'Retweet', 'SOTU']
2410;2410;2015-02-06 19:56:03;2090.0;563788231913648128;0.0;901.0;"<a href=""http://twitter.com"" rel=""nofollow"">Twitter Web Client</a>";"""I'm not pushing these ideas for my sake. I'm pushing them because I think this is where America needs to go."" —President Obama #Leadership";0.0;['insurance', 'mind', 't.co/vBmeYw3cSe']
2411;2411;2015-02-06 19:53:25;1456.0;563787569146515456;0.0;673.0;"<a href=""http://twitter.com"" rel=""nofollow"">Twitter Web Client</a>";"""At a time when the economy is picking up speed and growing again, we've got to work twice as hard."" —President Obama";0.1779;['security', 'coverage', 'Americans']
2412;2412;2015-02-06 19:52:49;2171.0;563787416092176384;0.0;1111.0;"<a href=""http://twitter.com"" rel=""nofollow"">Twitter Web Client</a>";"""I want to make sure that this is a country where hard work is rewarded."" —President Obama";0.29600000000000004;['jobs.', 'businesses', 'President']
2413;2413;2015-02-06 19:52:11;1346.0;563787259049025536;0.0;591.0;"<a href=""http://twitter.com"" rel=""nofollow"">Twitter Web Client</a>";"""We have risen from recession, freer to write our own future than any nation on earth."" —President Obama";-0.1779;['ideas', 'budget', 'Congress']
2414;2414;2015-02-06 19:47:53;1237.0;563786176750837760;0.0;470.0;"<a href=""http://twitter.com"" rel=""nofollow"">Twitter Web Client</a>";"""America is poised for another good year... as long as Washington works to keep this progress going."" —President Obama";0.7992;['momentum', 'crisis', 'time']
2415;2415;2015-02-06 19:46:49;1208.0;563785906469867521;0.0;473.0;"<a href=""http://twitter.com"" rel=""nofollow"">Twitter Web Client</a>";"""And, in the single most hopeful sign for middle-class families, wages are starting to go up again."" —President Obama";0.5563;['SOTU', 'decades', 'years']
2416;2416;2015-02-06 19:44:32;1243.0;563785333632798720;0.0;594.0;"<a href=""http://twitter.com"" rel=""nofollow"">Twitter Web Client</a>";"""Over the past 59 months, the private sector has added almost 12 million new jobs."" —President Obama";0.0;['sacrifice', 'generation', 'SOTU']
2417;2417;2015-02-06 19:43:41;1580.0;563785116682440704;0.0;925.0;"<a href=""http://twitter.com"" rel=""nofollow"">Twitter Web Client</a>";"""In 2014, our economy created 3.1 million jobs—and that's the best year of job growth since the 1990s."" —President Obama";0.8316;['SOTU', 'kids', 'people']
2418;2418;2015-02-06 19:31:16;753.0;563781993620459520;0.0;401.0;"<a href=""http://twitter.com"" rel=""nofollow"">Twitter Web Client</a>";LIVE: The President answers questions from students and faculty at Ivy Tech Community College in Indianapolis. http://t.co/v84rVrP58Z;0.0;['SOTU', 'crisis', 'rate']
2419;2419;2015-02-06 18:36:57;853.0;563768325985943552;0.0;394.0;"<a href=""http://twitter.com"" rel=""nofollow"">Twitter Web Client</a>";Tune in at 2:15 p.m. ET to watch President Obama take questions from students on jobs and education at a town hall: http://t.co/jOMmTxPlUt;0.0;['pace', 'economy', 'America']
2420;2420;2015-02-06 15:56:30;2071.0;563727946741870593;0.0;1294.0;"<a href=""http://twitter.com"" rel=""nofollow"">Twitter Web Client</a>";The economy added 257,000 jobs in January, part of the strongest three-month growth since 1997. Let's keep it going: http://t.co/bXXbvC1n6k;0.6705;['State', 'SOTU', 'Union']
2421;2421;2015-02-05 22:24:25;2676.0;563463178831417344;0.0;1511.0;"<a href=""http://twitter.com"" rel=""nofollow"">Twitter Web Client</a>";Good news: Wind and solar energy have tripled since 2008. http://t.co/osh3AsFWqB;0.6124;['speech', 'WhiteHouse', 'ET']
2423;2423;2015-02-05 17:06:22;1386.0;563383139758657538;0.0;563.0;"<a href=""http://twitter.com"" rel=""nofollow"">Twitter Web Client</a>";Jake has coverage he can count on, for less than he expected. #GetCovered http://t.co/NjJhUDnUiR;0.0;['SOTU', 'families', 'name']
2424;2424;2015-02-04 23:01:29;1187.0;563110119525728256;0.0;818.0;"<a href=""http://twitter.com"" rel=""nofollow"">Twitter Web Client</a>";The last chance to #GetCovered for 2015 is only days away. Find a plan today: http://t.co/4lQezMBknb http://t.co/oTh6b92jJ1;0.25;['friends', 'SOTU', 'game']
2425;2425;2015-02-04 19:54:20;1475.0;563063021225136129;0.0;732.0;"<a href=""http://twitter.com"" rel=""nofollow"">Twitter Web Client</a>";Today, President Obama met with young immigrants whose lives are positively affected by #ImmigrationAction. http://t.co/bmYOO4TKwb;0.4215;['name', 'agenda', 'Congress']
2426;2426;2015-02-04 18:38:33;964.0;563043951121530882;0.0;402.0;"<a href=""http://twitter.com"" rel=""nofollow"">Twitter Web Client</a>";Not that much time left to #GetCovered: http://t.co/nf95N0Umwf;0.0;['look', 'address', 't.co/bCW5Kt2Jb4']
2427;2427;2015-02-03 22:26:26;0.0;562738912196833280;0.0;357.0;"<a href=""http://twitter.com"" rel=""nofollow"">Twitter Web Client</a>";RT @OFA: Help commemorate #BlackHistoryMonth—it's on all of us to get involved and make a positive impact: http://t.co/HUpEY5KK9K;0.743;['families', 'Tonight', 'President']
2428;2428;2015-02-02 20:05:57;1332.0;562341168831164416;0.0;627.0;"<a href=""http://twitter.com"" rel=""nofollow"">Twitter Web Client</a>";Check out President Obama's comprehensive budget plan, and see how he's investing in middle-class families: http://t.co/gUcWhfu36y;0.25;['address', 'Tune', 'p.m']
2429;2429;2015-02-02 16:48:38;2804.0;562291512231604225;0.0;1367.0;"<a href=""http://twitter.com"" rel=""nofollow"">Twitter Web Client</a>";"""We have to pass a budget that gives middle-class families the security they need to get ahead in the new economy."" —President Obama";0.34;['Ma…', 'WhiteHouse', 'project']
2430;2430;2015-02-02 16:40:50;1167.0;562289550761152513;0.0;492.0;"<a href=""http://twitter.com"" rel=""nofollow"">Twitter Web Client</a>";LIVE: President Obama discusses how his budget will bring middle-class economics into the 21st century. http://t.co/9Y8HDe9GIE;0.0;['land', 'courage', 'resolve']
2431;2431;2015-02-02 14:25:04;0.0;562255385696796672;0.0;333.0;"<a href=""http://twitter.com"" rel=""nofollow"">Twitter Web Client</a>";RT @OFA: Okay, campers, rise and shine. Another attempt to repeal Obamacare is making it coooold out there today.;0.2263;['families', 'State', 'middle-class']
2432;2432;2015-01-31 21:16:23;3246.0;561634119625756672;0.0;1443.0;"<a href=""http://twitter.com"" rel=""nofollow"">Twitter Web Client</a>";"""I will keep doing everything I can to help more working families make ends meet and get ahead."" —President Obama http://t.co/exNWiYdigT";0.4019;['America', 'progress', 'right']
2433;2433;2015-01-31 15:54:16;1585.0;561553057029586944;0.0;653.0;"<a href=""http://twitter.com"" rel=""nofollow"">Twitter Web Client</a>";In the weekly address, President Obama lays the foundation for focusing on middle-class economics: http://t.co/wOAIO5wiLj;0.0;['address', 'Union', 'Watch']
2434;2434;2015-01-30 22:58:30;1197.0;561297429727686656;0.0;474.0;"<a href=""http://twitter.com"" rel=""nofollow"">Twitter Web Client</a>";Check getting covered off of your to-do list. Find a plan that works for you before the February 15th deadline: http://t.co/rV08U27qC2;0.0;['t.co/TBK1J1rk51', 'day', 'today']
2435;2435;2015-01-30 19:53:30;2305.0;561250873276239873;0.0;1626.0;"<a href=""http://twitter.com"" rel=""nofollow"">Twitter Web Client</a>";Climate change deniers, take note: The vast majority of Americans agree that it's time to #ActOnClimate. http://t.co/KTqwd2GQCV;0.1027;['Cheese', 'cast', 'West']
2436;2436;2015-01-30 16:19:16;1501.0;561196960485371904;0.0;713.0;"<a href=""http://twitter.com"" rel=""nofollow"">Twitter Web Client</a>";Happening now: President Obama speaks about investing in precision medicine to improve health and disease treatment. http://t.co/uf2kRxhxe5;0.4404;['ActOnClimate', 'record', 'time']
2437;2437;2015-01-30 00:12:42;3644.0;560953715373273088;0.0;1716.0;"<a href=""http://twitter.com"" rel=""nofollow"">Twitter Web Client</a>";Six years ago, the President signed the Lilly Ledbetter Fair Pay Act—but the fight for equal pay is far from over. http://t.co/isSTQvlWZ1;-0.2732;['nytimes', 'distress', 'people']
2438;2438;2015-01-29 22:58:30;1578.0;560935043502063616;0.0;682.0;"<a href=""http://twitter.com"" rel=""nofollow"">Twitter Web Client</a>";Parents will always worry about their kids. Give them some peace of mind—#GetCovered today. http://t.co/DGuJEY9TwF #YoEnroll;0.1531;['America', 'Retweet', 'energy']
2439;2439;2015-01-29 17:11:30;0.0;560847716578623488;0.0;983.0;"<a href=""http://twitter.com"" rel=""nofollow"">Twitter Web Client</a>";RT @WhiteHouse: Worth a read: President Obama on his blueprint for middle-class economics → http://t.co/7z81jGRcK9 #AmericaLeads http://t.c…;0.2263;['health', 'LAST', 'insurance']
2440;2440;2015-01-28 20:49:46;1484.0;560540258689753088;0.0;752.0;"<a href=""http://twitter.com"" rel=""nofollow"">Twitter Web Client</a>";Get a state-by-state breakdown on how much the President's #ImmigrationAction will benefit the economy: http://t.co/Lo8J5Q83Ul;0.4588;['leave', 'importance', 'LeadOnLeave']
2441;2441;2015-01-27 22:48:49;2047.0;560207829932310531;0.0;906.0;"<a href=""http://twitter.com"" rel=""nofollow"">Twitter Web Client</a>";9.5 million Americans have signed up for coverage—and we're not done yet. http://t.co/sMCzitJ9zX;0.0;['t.co/g0Bl2r2znU', 'health', 'Enroll']
2442;2442;2015-01-26 22:30:23;1751.0;559840802713513984;0.0;648.0;"<a href=""http://twitter.com"" rel=""nofollow"">Twitter Web Client</a>";.@VP stops by @TheEllenShow with a message for young adults: Give your mom some peace of mind and #GetCovered. http://t.co/MqMOsk9bWK;0.4404;['BetterBroadband', 'ICYMI', 'President']
2443;2443;2015-01-26 18:03:03;1478.0;559773526161244160;0.0;622.0;"<a href=""http://twitter.com"" rel=""nofollow"">Twitter Web Client</a>";If you need health insurance, find a plan that's right for you right now: http://t.co/0UFJ8hjXWt #GetCovered;0.0;['BW', 'SolarJobs', 'U.S.']
2444;2444;2015-01-26 16:44:02;1614.0;559753639925780480;0.0;712.0;"<a href=""http://twitter.com"" rel=""nofollow"">Twitter Web Client</a>";"""People want to see an agenda that moves us all forward."" Read President Obama's latest message to @OFA: http://t.co/AvnSlvXzD9";0.0772;['health', 'coverage', 'February']
2445;2445;2015-01-25 21:05:05;0.0;559456950514356224;0.0;1536.0;"<a href=""http://twitter.com"" rel=""nofollow"">Twitter Web Client</a>";RT @WhiteHouse: Big news: President Obama just announced a comprehensive plan to protect Alaska’s Arctic National Wildlife Refuge → http://…;0.5574;['emissions', 'TIME', 'ActOnClimate']
2446;2446;2015-01-24 18:52:49;1833.0;559061276593094656;0.0;855.0;"<a href=""http://twitter.com"" rel=""nofollow"">Twitter Web Client</a>";Watch the weekly address: We have to do everything we can to help more Americans get ahead in the new economy. http://t.co/78fbwjSDoQ;0.4019;['access', 'President', 'steps']
2447;2447;2015-01-24 16:52:39;4813.0;559031034273353728;0.0;3005.0;"<a href=""http://twitter.com"" rel=""nofollow"">Twitter Web Client</a>";"""Somewhere, the sun is shining, the air is fresh, his team's behind him, and Mr. Class—'Mr. Cub'—is ready to play two."" —President Obama";0.7351;['p.m', 'Tune', 'steps']
2448;2448;2015-01-23 21:54:17;1256.0;558744552974983168;0.0;518.0;"<a href=""http://twitter.com"" rel=""nofollow"">Twitter Web Client</a>";LIVE: President Obama is speaking at the U.S. Conference of Mayors. Watch here: http://t.co/1VYEZxI1sE;0.0;['reform', 'progress', 'solutions']
2449;2449;2015-01-23 20:41:36;6071.0;558726265163624448;0.0;5945.0;"<a href=""http://twitter.com"" rel=""nofollow"">Twitter Web Client</a>";These senators are at odds with 97% of climate scientists and NASA. #ActOnClimate http://t.co/zYUuwl7AFb;0.0;['day', 'coverage', 'health']
2450;2450;2015-01-23 15:57:26;1050.0;558654748883046401;0.0;408.0;"<a href=""http://twitter.com"" rel=""nofollow"">Twitter Web Client</a>";Watch: Don't be THAT person. Stop waiting around and #GetCovered today. http://t.co/JpjjF56nUh;-0.29600000000000004;['Watch', 'WhiteHouse', 'steps']
2451;2451;2015-01-22 23:28:11;3059.0;558405796615036929;0.0;1503.0;"<a href=""http://twitter.com"" rel=""nofollow"">Twitter Web Client</a>";"""I am deeply committed to protecting this core constitutional right."" —President Obama on the 42nd anniversary of #RoevWade";0.3384;['plan', 'deadline', 'GetCovered']
2452;2452;2015-01-22 22:09:11;2112.0;558385915047866368;0.0;907.0;"<a href=""http://twitter.com"" rel=""nofollow"">Twitter Web Client</a>";Happening now: President Obama is being interviewed by @YouTube stars Bethany Mota, GloZell Green and Hank Green. http://t.co/zuQTNEQ40d;0.0;['insurance', 'health', 't.co/HFoX0lt9t2']
2453;2453;2015-01-22 21:00:05;784.0;558368528214925312;0.0;342.0;"<a href=""http://twitter.com"" rel=""nofollow"">Twitter Web Client</a>";Read President Obama's latest message to @OFA supporters after his State of the Union address: http://t.co/0wx6bFgQ6b;0.4404;['sector', 'months', 'growth']
2454;2454;2015-01-22 19:41:56;1677.0;558348860024553472;0.0;1588.0;"<a href=""http://twitter.com"" rel=""nofollow"">Twitter Web Client</a>";Find out which senators just went on the record to say that man-made climate change isn't real: http://t.co/Nbeqct6iHG #ActOnClimate;0.0;['states', 'start', 'wage']
2455;2455;2015-01-22 17:34:26;1038.0;558316774999871488;0.0;485.0;"<a href=""http://twitter.com"" rel=""nofollow"">Twitter Web Client</a>";LIVE: President Obama is speaking at @KUNews about middle-class economics. Tune in: http://t.co/DAJMCOnFQ1;0.0;['shoulder', 'minds', 'Americans']
2456;2456;2015-01-22 17:06:39;1124.0;558309783397081089;0.0;475.0;"<a href=""http://twitter.com"" rel=""nofollow"">Twitter Web Client</a>";Next stop: Kansas. Tune in at 12:25 p.m. ET to watch President Obama talk about middle-class economics. http://t.co/m4PValiRjb;-0.29600000000000004;['movement', 'children', 'Congress']
2457;2457;2015-01-21 23:26:29;0.0;558042983459999744;0.0;271.0;"<a href=""http://twitter.com"" rel=""nofollow"">Twitter Web Client</a>";RT @OFA: After his State of the Union address, President Obama sent a message for OFA supporters. Read it here: http://t.co/BPshO1WHa8;0.4404;['Michelle', 'children', 'online']
2458;2458;2015-01-21 22:04:47;1105.0;558022423396634625;0.0;422.0;"<a href=""http://twitter.com"" rel=""nofollow"">Twitter Web Client</a>";LIVE: A day after his State of the Union address, President Obama is in Idaho spekaing at @BoiseStateLive. Tune in: http://t.co/gDQwNgjSf3;0.0;['Cybersecurity', 'kids', 'matter']
2459;2459;2015-01-21 19:39:54;1507.0;557985960411938817;0.0;682.0;"<a href=""http://twitter.com"" rel=""nofollow"">Twitter Web Client</a>";President Obama is doing what he can to fight for middle-class families. Take a stand on this: http://t.co/fChzMIQOlZ;-0.3818;['privacy', 'people', 'Cybersecurity']
2460;2460;2015-01-21 17:41:09;1153.0;557956075836547073;0.0;549.0;"<a href=""http://twitter.com"" rel=""nofollow"">Twitter Web Client</a>";It's #BigBlockOfCheeseDay: Check out the schedule of White House staff answering your questions. http://t.co/g2EKBztnvL;0.0;['Cybersecurity']
2462;2462;2015-01-21 03:20:55;0.0;557739589549690884;0.0;398.0;"<a href=""http://twitter.com"" rel=""nofollow"">Twitter Web Client</a>";RT @OFA: The cynics are wrong. If you refuse to give in to cynicism, this is the movement for you: http://t.co/iq2CLxKyv6 #SOTU;-0.8074;['consumer', 'Trade', 'privacy']
2463;2463;2015-01-21 03:16:56;4091.0;557738590818795520;0.0;2652.0;"<a href=""http://twitter.com"" rel=""nofollow"">Twitter Web Client</a>";"""Let’s begin this new chapter—together—and let’s start the work right now."" —President Obama #SOTU #AmericaLeads";0.0;['speak', 't.co/jZ6uwEMZoW', 'theft']
2464;2464;2015-01-21 03:15:07;3754.0;557738133086040064;0.0;2175.0;"<a href=""http://twitter.com"" rel=""nofollow"">Twitter Web Client</a>";"""My fellow Americans, we too are a strong, tight-knit family. We, too, have made it through some hard times."" —President Obama #SOTU";0.4404;['America', 'speed', 't.co/Tgfngj1TwO']
2465;2465;2015-01-21 03:12:15;6457.0;557737410059321346;0.0;5860.0;"<a href=""http://twitter.com"" rel=""nofollow"">Twitter Web Client</a>";"""I want future generations to know that we are a people that see our differences as a great gift."" —President Obama #SOTU";0.6597;['resurgence', 'address', 'America']
2466;2466;2015-01-21 03:10:51;2865.0;557737056580149248;0.0;1762.0;"<a href=""http://twitter.com"" rel=""nofollow"">Twitter Web Client</a>";"""If you share the broad vision I outlined tonight, join me in the work at hand."" —President Obama #SOTU #AmericaLeads";0.6597;['President', 'LIVE', 'college']
