;Unnamed: 0;created_at;favorite_count;id_str;is_retweet;retweet_count;source;text;sentiment;topic_words
782;782;2016-03-19 19:45:08;10100.0;711277342832746496;0.0;3586.0;"<a href=""http://twitter.com"" rel=""nofollow"">Twitter Web Client</a>";"""Give Judge Garland the respect he has earned. Give him a hearing. Give him an up-or-down vote."" —President Obama https://t.co/R2qBVx7O6s";0.4767;['leaders', 'hearing', 'nominee']
783;783;2016-03-19 17:13:57;3950.0;711239296334712833;0.0;934.0;"<a href=""http://twitter.com"" rel=""nofollow"">Twitter Web Client</a>";In the weekly address, President Obama urges the Senate to give Judge Garland a fair hearing and timely vote: https://t.co/1EuiCg8e8E;0.3182;['job', 'expectation', 'WhiteHouse']
784;784;2016-03-18 21:05:01;2636.0;710935059583279104;0.0;806.0;"<a href=""http://twitter.com"" rel=""nofollow"">Twitter Web Client</a>";Read from @business editorial board on why Judge Merrick Garland deserves a fair hearing: https://t.co/yzIDDgOfEs;0.3182;['nominees', 'Senators', 'times']
785;785;2016-03-18 19:40:16;1836.0;710913733371899904;0.0;492.0;"<a href=""http://twitter.com"" rel=""nofollow"">Twitter Web Client</a>";Check out how @OFA supporters are calling for a fair #SCOTUS hearing and timely up-or-down vote: https://t.co/JFf3hAf189;0.6369;['VP', 'hearing', 't.co/DKjBws90CZ']
786;786;2016-03-18 17:03:47;24928.0;710874353068421124;0.0;32439.0;"<a href=""http://twitter.com"" rel=""nofollow"">Twitter Web Client</a>";Retweet if you believe Judge Merrick Garland deserves fair consideration. #DoYourJobFriday https://t.co/NYvoxcFO8H;0.3182;['family', 'families', 'job']
787;787;2016-03-18 15:52:40;2599.0;710856454333288448;0.0;1148.0;"<a href=""http://twitter.com"" rel=""nofollow"">Twitter Web Client</a>";Make your voice heard on a fair #SCOTUS nomination process for Judge Merrick Garland: https://t.co/9kCCJ2ebUp;0.3182;['name', 'job', 'DoYourJob']
789;789;2016-03-17 21:24:13;1694.0;710577503329341440;0.0;470.0;"<a href=""http://twitter.com"" rel=""nofollow"">Twitter Web Client</a>";Yesterday President Obama revealed his March Madness bracket. Check it out: https://t.co/AzKCRr5DQg #Baracketology;-0.4404;['school', 'child', 't.co/FonwXC…']
790;790;2016-03-17 19:19:46;12963.0;710546185480642560;0.0;4175.0;"<a href=""http://twitter.com"" rel=""nofollow"">Twitter Web Client</a>";President Obama took his constitutional duty seriously and nominated a well qualified #SCOTUSnominee. https://t.co/zTOKXgLnj8;0.1027;['jobs', 'Senate', 'leaders']
791;791;2016-03-17 17:24:25;6406.0;710517154987122689;0.0;2685.0;"<a href=""http://twitter.com"" rel=""nofollow"">Twitter Web Client</a>";Judge Garland is a qualified #SCOTUSnominee with past bipartisan approval—show your support: https://t.co/rh4XUpRSws https://t.co/MHhTEoewLn;0.4019;['nomination', 'VP', 'process']
792;792;2016-03-17 16:33:45;0.0;710504406521806848;0.0;1151.0;"<a href=""http://twitter.com"" rel=""nofollow"">Twitter Web Client</a>";"RT @WhiteHouse: ""He is the right man for the job. He deserves to be confirmed."" —@POTUS on his #SCOTUSnominee Merrick Garland https://t.co/…";0.0;['women', 't.co/bqi94Ao2iV', 'InternationalWomensDay']
793;793;2016-03-16 20:58:14;7970.0;710208575512158208;0.0;2836.0;"<a href=""http://twitter.com"" rel=""nofollow"">Twitter Web Client</a>";Judge Merrick Garland deserves a fair hearing and a timely vote. #SCOTUSnominee https://t.co/raFkOw5N3C;0.3182;['year', 'numbers', 'ActOnClimate']
794;794;2016-03-16 15:04:56;2219.0;710119666937499649;0.0;661.0;"<a href=""http://twitter.com"" rel=""nofollow"">Twitter Web Client</a>";HAPPENING NOW: President Obama is announcing his nominee to fill the #SCOTUS vacancy. https://t.co/ZDrkhxZpTB;0.0;['t.co/MoaVS02Crw', 'anything', 'Selma']
795;795;2016-03-16 13:41:54;1802.0;710098768276787200;0.0;679.0;"<a href=""http://twitter.com"" rel=""nofollow"">Twitter Web Client</a>";Tune in at 11 a.m. ET to watch President Obama announce his #SCOTUSnominee: https://t.co/IXUu3eUHdv;0.0;['president', 'nominee', 'SCOTUS']
796;796;2016-03-15 19:55:30;2441.0;709830400474939392;0.0;979.0;"<a href=""http://twitter.com"" rel=""nofollow"">Twitter Web Client</a>";Senate leaders shouldn't hold up the Supreme Court nomination process—sign the petition: https://t.co/HPbnxeAKmT;0.5574;['petition', 'excuse', 'OFA']
797;797;2016-03-15 18:31:15;2074.0;709809198314364929;0.0;819.0;"<a href=""http://twitter.com"" rel=""nofollow"">Twitter Web Client</a>";These editorials explain why the Senate must do its job and hold fair #SCOTUS nomination hearings: https://t.co/0Erxa1SnlA #DoYourJob;0.3182;['hearing', 'SCOTUS', 'Americans']
798;798;2016-03-15 16:42:42;1986.0;709781884343951360;0.0;1069.0;"<a href=""http://twitter.com"" rel=""nofollow"">Twitter Web Client</a>";This February was so hot that it shattered global records. Check it out: https://t.co/7tkAzF6CT8 #ActOnClimate;-0.4767;['WhiteHouse', 'POTUS', 'life']
799;799;2016-03-15 15:30:18;2291.0;709763663201054720;0.0;720.0;"<a href=""http://twitter.com"" rel=""nofollow"">Twitter Web Client</a>";There's a lot of misinformation out there—help spread the facts with the @OFA Truth Team: https://t.co/srdrvXgfKA https://t.co/MrkBKYeCnm;0.0;['nominee', 'hearing', 'DoYourJob']
801;801;2016-03-14 20:23:04;3362.0;709474949962932229;0.0;1237.0;"<a href=""http://twitter.com"" rel=""nofollow"">Twitter Web Client</a>";By a margin of nearly 2-to-1, Americans believe the Senate should hold hearings on a #SCOTUS nominee: https://t.co/zssLeUT1O3;0.0;['plenty', 'duty', 't.co/X8kMjL1pdc']
802;802;2016-03-14 16:52:36;9936.0;709421986020085760;0.0;4577.0;"<a href=""http://twitter.com"" rel=""nofollow"">Twitter Web Client</a>";Refusing to even meet with a #SCOTUS nominee has no basis in the Constitution. #DoYourJob https://t.co/5xqIrZVLqj;-0.5994;['jobs', 't.co/xCkKrs9gJp', 'February']
803;803;2016-03-14 15:37:36;2069.0;709403111706656768;0.0;700.0;"<a href=""http://twitter.com"" rel=""nofollow"">Twitter Web Client</a>";If you think the Senate should give President Obama's #SCOTUS nominee a fair hearing, add your name: https://t.co/tFFrncdg1W #DoYourJob;0.3182;['jobs', 'growth', 'February—a']
804;804;2016-03-11 21:59:35;0.0;708412076268457984;0.0;4917.0;"<a href=""http://twitter.com"" rel=""nofollow"">Twitter Web Client</a>";"RT @WhiteHouse: ""We avoided a Great Depression. 
Thanks, Obama.""
—@POTUS #SXSW2016 https://t.co/BBcKZOD8cW";0.2263;['someone', 'majority', 't.co/RGQEw9WAc2']
805;805;2016-03-11 21:03:21;1526.0;708397926955921408;0.0;533.0;"<a href=""http://twitter.com"" rel=""nofollow"">Twitter Web Client</a>";LIVE: President Obama is participating in a #SXSW2016 panel on civic engagement and technology. https://t.co/BBoIZW0LWP;0.4588;['security', 't.…', 'health']
806;806;2016-03-11 18:09:50;4936.0;708354258371010560;0.0;1432.0;"<a href=""http://twitter.com"" rel=""nofollow"">Twitter Web Client</a>";The Senate should fairly consider a #SCOTUS nominee—sign the petition if you agree: https://t.co/clUtC1qTb8 https://t.co/UmjWwD7sQw;0.3612;['President', 'LIVE', 't.co/aB2PNdzoXT']
807;807;2016-03-11 16:03:46;2171.0;708322530889588737;0.0;875.0;"<a href=""http://twitter.com"" rel=""nofollow"">Twitter Web Client</a>";Not caught up on the Supreme Court vacancy? Read what editorial boards around the country are saying: https://t.co/ALJKaArA7i #DoYourJob;0.5574;['nomination', 'petition—join', 'thousands']
808;808;2016-03-10 23:06:42;3176.0;708066580916113408;0.0;1059.0;"<a href=""http://twitter.com"" rel=""nofollow"">Twitter Web Client</a>";The United States and Canada are joining together to reduce methane pollution. Read more: https://t.co/RfWitsRxpB #ActOnClimate;0.4215;['Milwaukee', 'Tune', 'p.m']
809;809;2016-03-10 21:29:37;0.0;708042148512333824;0.0;753.0;"<a href=""http://twitter.com"" rel=""nofollow"">Twitter Web Client</a>";"RT @FactsOnClimate: ""Canada is joining us in our aggressive goal to bring down methane emissions in the oil and gas sector"" —@POTUS https:/…";-0.1531;['DoYourJob', 'consensus', 't.co/t7ZGvXIpIk']
810;810;2016-03-10 20:04:53;2420.0;708020822762332161;0.0;1208.0;"<a href=""http://twitter.com"" rel=""nofollow"">Twitter Web Client</a>";Refusing to hold a hearing on a presidential nominee is unprecedented. Tell Senate leaders: #DoYourJob https://t.co/jmqg76dutN;-0.4019;['minimum', 'news', 'time']
811;811;2016-03-10 18:46:17;0.0;708001044727377920;0.0;890.0;"<a href=""http://twitter.com"" rel=""nofollow"">Twitter Web Client</a>";"RT @WhiteHouse: ""I'm going to do my job and then my expectation is going to be will the Senate do its job"" —@POTUS #SCOTUS https://t.co/sNB…";0.0;['t.co/ubjy1N9NlS', 'gridlock', 'DoYourJob']
812;812;2016-03-10 16:31:49;1921.0;707967205967724544;0.0;912.0;"<a href=""http://twitter.com"" rel=""nofollow"">Twitter Web Client</a>";Senators on the Judiciary Committee have demanded a vote on judicial nominees 90 times. Here's a list: https://t.co/hjOn65IgI4 #DoYourJob;-0.2263;['obstruction', 'Supreme', 'petition']
813;813;2016-03-09 21:35:04;2509.0;707681130074353664;0.0;957.0;"<a href=""http://twitter.com"" rel=""nofollow"">Twitter Web Client</a>";"""Under my chairmanship, every Supreme Court nominee was given a hearing and a vote in the Judiciary Committee."" —@VP https://t.co/DKjBws90CZ";0.5574;['DoYourJob', 'SCOTUS', 'nominee']
814;814;2016-03-09 19:49:33;0.0;707654578783662081;0.0;1076.0;"<a href=""http://twitter.com"" rel=""nofollow"">Twitter Web Client</a>";RT @WhiteHouse: Vermont just took the #LeadOnLeave so families won't have to choose between their job and the family they love. https://t.c…;0.6369;['t.co/rc…', 'dreams', 'POTUS']
815;815;2016-03-09 18:13:25;4360.0;707630384943509504;0.0;1409.0;"<a href=""http://twitter.com"" rel=""nofollow"">Twitter Web Client</a>";Add your name if you think the Senate should do its job: https://t.co/cRmr4M8lSl #DoYourJob https://t.co/DNxgqTSRTN;0.0;['seat', 'Supreme', ' Court']
816;816;2016-03-09 16:42:36;1767.0;707607528276754432;0.0;576.0;"<a href=""http://twitter.com"" rel=""nofollow"">Twitter Web Client</a>";"""Senate needs to think and vote."" See what editorials boards are saying about the Supreme Court nomination: https://t.co/ENU64s5Cud";0.5574;['ActOnClimate', 'rise', 'sea-levels']
817;817;2016-03-08 23:01:53;0.0;707340593077329921;0.0;3477.0;"<a href=""http://twitter.com"" rel=""nofollow"">Twitter Web Client</a>";RT @FLOTUS: #OneDayIWill see a world where every child can go to school and fulfill their boundless potential. #IWD2016 https://t.co/FonwXC…;0.4404;['nomination', 'facts', 'process']
818;818;2016-03-08 21:50:50;3096.0;707322712293662720;0.0;1226.0;"<a href=""http://twitter.com"" rel=""nofollow"">Twitter Web Client</a>";The President is going to nominate a qualified Supreme Court Justice—tell Senate leaders to do their jobs: https://t.co/uks53rbxHX;0.5574;['birthday', 'Thanks', 'PeaceCorps']
819;819;2016-03-08 20:20:10;1036.0;707299895099568129;0.0;316.0;"<a href=""http://twitter.com"" rel=""nofollow"">Twitter Web Client</a>";From @VP Biden: Why the Senate shouldn't hold back the #SCOTUS nomination process. https://t.co/A61OoqQszS;0.0;['nominee', 'duty', 't.co/yquRBNfS9k']
820;820;2016-03-08 18:23:14;13270.0;707270467858501632;0.0;7645.0;"<a href=""http://twitter.com"" rel=""nofollow"">Twitter Web Client</a>";We've come a long way on women's equality, but there's still so much work to be done. #InternationalWomensDay https://t.co/bqi94Ao2iV;0.0;['election', 'presidents', 'washingtonpost']
821;821;2016-03-08 16:35:48;2198.0;707243431471370240;0.0;859.0;"<a href=""http://twitter.com"" rel=""nofollow"">Twitter Web Client</a>";"""U.S. solar seems poised for not just a record year but perhaps a blowout year."" Get the numbers: https://t.co/MfDphKshcl #ActOnClimate";0.128;['Supreme', 'nomination', 'process']
822;822;2016-03-07 23:09:42;19066.0;706980169349632000;0.0;6312.0;"<a href=""http://twitter.com"" rel=""nofollow"">Twitter Web Client</a>";"""If Selma taught us anything, it’s that our work is never done."" —President Obama #Selma51 https://t.co/MoaVS02Crw";0.0;['President', 'Senior', 'Medal']
823;823;2016-03-07 20:49:06;4937.0;706944787979444224;0.0;3427.0;"<a href=""http://twitter.com"" rel=""nofollow"">Twitter Web Client</a>";Refusing to hold hearings for a president's #SCOTUS nominee has never happened before. https://t.co/G7knZPAy7x;-0.4019;['species', 'WhiteHouse', 'threat']
824;824;2016-03-07 18:47:12;2178.0;706914111565606913;0.0;825.0;"<a href=""http://twitter.com"" rel=""nofollow"">Twitter Web Client</a>";There is no excuse to delay the #SCOTUS nomination—add your name to @OFA's petition if you agree: https://t.co/WMFAOI6czO;-0.1779;['VP', 'Nothing', 'Did']
825;825;2016-03-07 16:24:07;3893.0;706878103373516800;0.0;1294.0;"<a href=""http://twitter.com"" rel=""nofollow"">Twitter Web Client</a>";Most Americans agree that the Senate should do its job and give the #SCOTUS nominee a fair hearing: https://t.co/8pA0rFXwrm #DoYourJob;0.6222;['jobs', 'hundreds', 't.co/U82fX6P2nB']
826;826;2016-03-06 21:16:43;0.0;706589348922302464;0.0;2390.0;"<a href=""http://twitter.com"" rel=""nofollow"">Twitter Web Client</a>";"RT @WhiteHouse: ""We remain grateful for Nancy Reagan's life"" —@POTUS and @FLOTUS: https://t.co/nJZIHumlsS https://t.co/KftNACmkAh";0.4588;['way', 't.co/UzcGjwykjs', 'economy']
827;827;2016-03-04 23:15:43;3227.0;705894523176685568;0.0;1303.0;"<a href=""http://twitter.com"" rel=""nofollow"">Twitter Web Client</a>";A well-qualified #SCOTUS nominee deserves a fair hearing and a timely up-or-down vote. https://t.co/rBZe7gz2vD #DoYourJob;0.3182;['way', 'jobs', 'day']
828;828;2016-03-04 22:05:47;2052.0;705876922752962560;0.0;795.0;"<a href=""http://twitter.com"" rel=""nofollow"">Twitter Web Client</a>";Take a look at what editorial boards across the country think of the Senate refusing to do its job: https://t.co/6n3JNK6WoZ #DoYourJob;-0.4019;['record', 'jobs', 'streak']
829;829;2016-03-04 20:50:03;7641.0;705857862384353285;0.0;3586.0;"<a href=""http://twitter.com"" rel=""nofollow"">Twitter Web Client</a>";It's the Senate's duty to fairly consider the President's #SCOTUS nominee—and there's plenty of time to do so. https://t.co/X8kMjL1pdc;0.0;['progress', 'economy', 'LIVE']
830;830;2016-03-04 19:02:15;2849.0;705830736302088192;0.0;927.0;"<a href=""http://twitter.com"" rel=""nofollow"">Twitter Web Client</a>";February's 242,000 new jobs mean the American economy has been creating jobs for six straight years. https://t.co/xCkKrs9gJp;0.4767;['future', 'POTUS', 't.co/R…']
832;832;2016-03-04 15:40:25;5766.0;705779942852845568;0.0;2093.0;"<a href=""http://twitter.com"" rel=""nofollow"">Twitter Web Client</a>";The economy added 242,000 jobs in February—a record-breaking six straight years of private-sector job growth.;0.5423;['Supreme', 'Senate', ' Court']
833;833;2016-03-03 22:45:16;4239.0;705524471285690369;0.0;1409.0;"<a href=""http://twitter.com"" rel=""nofollow"">Twitter Web Client</a>";The majority of Americans agree that President Obama should nominate someone to fill the #SCOTUS vacancy: https://t.co/RGQEw9WAc2;0.3612;['nominee', 'Senate', 'DoYourJob']
834;834;2016-03-03 20:49:46;0.0;705495403827859456;0.0;1086.0;"<a href=""http://twitter.com"" rel=""nofollow"">Twitter Web Client</a>";RT @WhiteHouse: BREAKING: 20 million more Americans now know the security of health insurance thanks to the Affordable Care Act. https://t.…;0.8176;['vacancy', 'Supreme', ' Court']
835;835;2016-03-03 19:53:46;1092.0;705481312119836672;0.0;330.0;"<a href=""http://twitter.com"" rel=""nofollow"">Twitter Web Client</a>";LIVE: President Obama is celebrating Milwaukee's victory in the Healthy Communities Challenge. https://t.co/aB2PNdzoXT;0.7717;['games', 'Supreme', 't.co/NE380YtV41']
836;836;2016-03-03 18:18:36;2143.0;705457363872980992;0.0;985.0;"<a href=""http://twitter.com"" rel=""nofollow"">Twitter Web Client</a>";Sign the petition—join the thousands of voices speaking up for a fair Supreme Court nomination process: https://t.co/BAOLv8FMEA #DoYourJob;0.7096;['t.co/9M4rqbVGCC', 'installations', 'time']
837;837;2016-03-03 17:20:30;1109.0;705442738829807616;0.0;334.0;"<a href=""http://twitter.com"" rel=""nofollow"">Twitter Web Client</a>";Tune in at 12:50 p.m. ET to see President Obama congratulate Milwaukee on winning the Healthy Communities Challenge. https://t.co/JAbnRHsWSi;0.8625;['t…', 'WhiteHouse', 'Congress']
838;838;2016-03-03 16:19:38;2120.0;705427424301813761;0.0;955.0;"<a href=""http://twitter.com"" rel=""nofollow"">Twitter Web Client</a>";This is what a consensus looks like. #DoYourJob https://t.co/t7ZGvXIpIk;0.3612;['leaders', 'kind', 'obstruction']
839;839;2016-03-02 22:38:59;0.0;705160499902726145;0.0;2792.0;"<a href=""http://twitter.com"" rel=""nofollow"">Twitter Web Client</a>";"RT @WhiteHouse: Good news: Oregon just raised its minimum wage. 

RT if you agree it's time to #RaiseTheWage for all Americans. https://t.c…";0.6597;['Supreme', 'nomination', 'process']
840;840;2016-03-02 21:07:10;6806.0;705137396187340800;0.0;3405.0;"<a href=""http://twitter.com"" rel=""nofollow"">Twitter Web Client</a>";Deliberately creating partisan gridlock is not the way our democracy should work. #DoYourJob https://t.co/ubjy1N9NlS;0.29600000000000004;['responsibility', 'nominee', 'President']
841;841;2016-03-02 18:49:47;2291.0;705102823558684672;0.0;1112.0;"<a href=""http://twitter.com"" rel=""nofollow"">Twitter Web Client</a>";The obstruction of our Supreme Court is completely unprecedented. Sign the petition telling the Senate: #DoYourJob. https://t.co/STmBjGzaA0;0.5574;['Supreme', 'Senate', 'nominee']
842;842;2016-03-02 16:32:38;12261.0;705068308421169152;0.0;7011.0;"<a href=""http://twitter.com"" rel=""nofollow"">Twitter Web Client</a>";Refusing to consider a #SCOTUS nominee before one is even announced is irresponsible. #DoYourJob https://t.co/NiZtwUHmE5;-0.6808;['excuse', 'days', 't.co/ultmGstueA']
843;843;2016-03-01 23:25:50;0.0;704809903769059328;0.0;878.0;"<a href=""http://twitter.com"" rel=""nofollow"">Twitter Web Client</a>";RT @WhiteHouse: Here's what @POTUS is doing to help women achieve their dreams: https://t.co/3g3TWF3qrq #WomensHistoryMonth https://t.co/rc…;0.6597;['part', 'Truth', 't.co/51zJn9N8qa']
844;844;2016-03-01 22:22:22;2781.0;704793932694065152;0.0;1310.0;"<a href=""http://twitter.com"" rel=""nofollow"">Twitter Web Client</a>";Leaving a seat open on the Supreme Court for more than a year is irresponsible—sign the petition: https://t.co/qWvL5ANmqP #DoYourJob;0.5574;['statement', 'President', ' Room']
845;845;2016-03-01 20:50:17;5194.0;704770760259166208;0.0;2764.0;"<a href=""http://twitter.com"" rel=""nofollow"">Twitter Web Client</a>";We're seeing the fastest rise in sea-levels in nearly 3,000 years: https://t.co/MwO2QKE4GW #ActOnClimate;0.0;['democracy—read', 'nomination', 'process']
846;846;2016-03-01 18:37:51;2033.0;704737428796366848;0.0;619.0;"<a href=""http://twitter.com"" rel=""nofollow"">Twitter Web Client</a>";Get the facts on everything from a fair #SCOTUS nomination process to climate change: https://t.co/jCZzreLARW https://t.co/qnB5GLM8eC;0.3182;['petition', 'Speak', 'process']
847;847;2016-03-01 17:02:47;3095.0;704713505153392640;0.0;881.0;"<a href=""https://www.thunderclap.it"" rel=""nofollow"">Thunderclap</a>";Today's the 55th birthday of the @PeaceCorps. Thanks to all who have served across the globe. #PeaceCorpsWeek2016;0.4404;['games', 'Supreme', ' Court']
848;848;2016-02-29 23:05:20;8724.0;704442358058717185;0.0;4410.0;"<a href=""http://twitter.com"" rel=""nofollow"">Twitter Web Client</a>";It's the Senate's duty to give the President's nominee a fair hearing and a timely vote. #DoYourJob https://t.co/yquRBNfS9k;0.3182;['nominees', 'latimes', 'Senate']
849;849;2016-02-29 20:53:18;2761.0;704409128634966016;0.0;1426.0;"<a href=""http://twitter.com"" rel=""nofollow"">Twitter Web Client</a>";"""One-third of all U.S. presidents appointed a Supreme Court justice in an election year."" https://t.co/PY8dR1owzf (h/t @washingtonpost)";0.7906;['name', 'hostage', 'politics']
850;850;2016-02-29 19:05:55;1768.0;704382105283788801;0.0;658.0;"<a href=""http://twitter.com"" rel=""nofollow"">Twitter Web Client</a>";Sign @OFA's petition to let the Senate know you demand a fair Supreme Court nomination process: https://t.co/SeDGtpwnU5;0.6597;['t.co/BQj2jXrztj', 'davidplouffe', 'ObamaAndKids']
851;851;2016-02-29 16:17:30;1563.0;704339724433911808;0.0;438.0;"<a href=""http://twitter.com"" rel=""nofollow"">Twitter Web Client</a>";LIVE: President Obama is presenting the Medal of Honor to Senior Chief Special Warfare Operator Edward Byers. https://t.co/NGInOc0ccN;0.7783;['pictures', 'everyone', 'ObamaAndKids']
852;852;2016-02-29 15:59:52;0.0;704335283135729664;0.0;8206.0;"<a href=""http://twitter.com"" rel=""nofollow"">Twitter Web Client</a>";"RT @WhiteHouse: Climate change ""is the most urgent threat facing our entire species.""

RT if you agree with @LeoDiCaprio. #Oscars https://t…";-0.022000000000000002;['skills', 'fellow', 't.co/q4t5Da7uyW']
853;853;2016-02-29 04:31:38;0.0;704162086889394176;0.0;795.0;"<a href=""http://twitter.com"" rel=""nofollow"">Twitter Web Client</a>";"RT @VPLive: ""They. Did. Nothing. Wrong."" -@VP at #Oscars #ItsOnUs";0.0;['climate', 'change', 'ActOnClimate']
854;854;2016-02-26 23:08:52;3920.0;703356080932286464;0.0;1376.0;"<a href=""http://twitter.com"" rel=""nofollow"">Twitter Web Client</a>";Thanks to the #RecoveryAct, clean energy investments have created hundreds of thousands of jobs. https://t.co/U82fX6P2nB;0.8271;['streak', 'rate—middle-class', 't.co/jWIZ0IZwL1']
855;855;2016-02-26 22:00:48;1771.0;703338952967598080;0.0;600.0;"<a href=""http://twitter.com"" rel=""nofollow"">Twitter Web Client</a>";Our economy has come a long way, but there's more work to do—say you support common-sense economic policies: https://t.co/UzcGjwykjs;0.5499;['ActOnClimate', 'January', 'month']
856;856;2016-02-26 20:55:05;3490.0;703322414181036032;0.0;1339.0;"<a href=""http://twitter.com"" rel=""nofollow"">Twitter Web Client</a>";Seven years ago, our economy was shedding nearly 800,000 jobs a day. We've come a long way. https://t.co/ueSHbf52YE;0.0;['WhiteHouse', 'President', 'champs']
857;857;2016-02-26 19:25:16;5987.0;703299811991138304;0.0;2495.0;"<a href=""http://twitter.com"" rel=""nofollow"">Twitter Web Client</a>";Our economy has added 14 million jobs over the longest streak of private-sector job growth on record. https://t.co/FwScd1Soxi;0.3818;['part', 'VP', 't.co/mKwr9m3608']
858;858;2016-02-26 18:46:41;1185.0;703290100914860032;0.0;404.0;"<a href=""http://twitter.com"" rel=""nofollow"">Twitter Web Client</a>";LIVE: President Obama is highlighting the progress of the American economy. https://t.co/7noFkjk0F8;0.4215;['economy', 'progress', 't.co/D1XXOQVPCT']
859;859;2016-02-26 18:39:56;0.0;703288404113383424;0.0;490.0;"<a href=""http://twitter.com"" rel=""nofollow"">Twitter Web Client</a>";"RT @ENERGY: It's been 7 years since @POTUS signed the #RecoveryAct. See how it shaped our #CleanEnergy future. #ActOnClimate
https://t.co/R…";0.0;['nominee', 'Watch', 't.…']
860;860;2016-02-26 17:56:13;1106.0;703277403557105664;0.0;386.0;"<a href=""http://twitter.com"" rel=""nofollow"">Twitter Web Client</a>";Tune in at 1:55 p.m. ET to see President Obama speak about the economic progress we've made since the #RecoveryAct. https://t.co/Ve3DprDXKH;0.4215;['artists', 'Shoutout', 'brighter']
861;861;2016-02-26 16:47:42;2263.0;703260160496521216;0.0;1026.0;"<a href=""http://twitter.com"" rel=""nofollow"">Twitter Web Client</a>";Tell the Senate: Stop playing games with our Supreme Court. https://t.co/2vkSnL2KWC #DoYourJob;0.4939;['Day', 'LoveIsLove', 'Valentines']
862;862;2016-02-26 01:02:26;6135.0;703022274056744960;0.0;3153.0;"<a href=""http://twitter.com"" rel=""nofollow"">Twitter Web Client</a>";The Senate should fulfill its constitutional duty and fairly consider the President's nominee. #DoYourJob https://t.co/AXpbOQ1bxD;0.4404;['pride', 'Valentines', 'Day']
863;863;2016-02-25 21:55:09;2995.0;702975142058536960;0.0;1372.0;"<a href=""http://twitter.com"" rel=""nofollow"">Twitter Web Client</a>";Add your name if you agree: Failing to fill the Supreme Court vacancy for over a year is unacceptable. https://t.co/uDxtenkam5 #DoYourJob;-0.0516;['LoveIsLove', 'Stand', 'equality']
864;864;2016-02-25 19:20:05;16305.0;702936121659920384;0.0;15797.0;"<a href=""http://twitter.com"" rel=""nofollow"">Twitter Web Client</a>";Retweet if you agree that we can't afford to play political games over the Supreme Court vacancy. #DoYourJob https://t.co/NE380YtV41;0.6204;['Watch', 'President', 'LGBT']
865;865;2016-02-25 16:42:22;2682.0;702896429765783552;0.0;1007.0;"<a href=""http://twitter.com"" rel=""nofollow"">Twitter Web Client</a>";The solar industry hit record growth last year, surpassing natural gas installations for the first time: https://t.co/9M4rqbVGCC;0.6249;['t.co/IrcnE2T88M', 'change', 'technology']
866;866;2016-02-24 22:56:36;0.0;702628219724419073;0.0;1942.0;"<a href=""http://twitter.com"" rel=""nofollow"">Twitter Web Client</a>";"RT @WhiteHouse: .@POTUS nominates the first woman and first African-American to be Librarian of Congress: https://t.co/5zQhYVj74j
https://t…";0.0;['sea', 'Thanks', 'FindYourPark']
867;867;2016-02-24 19:14:28;5861.0;702572317671444480;0.0;3973.0;"<a href=""http://twitter.com"" rel=""nofollow"">Twitter Web Client</a>";This kind of obstruction is unprecedented. Tell Senate leaders: #DoYourJob https://t.co/IZgCuoWE4O;0.0;['predecessors—and', 'land', 'FindYourPark']
868;868;2016-02-24 17:50:18;1796.0;702551138525052931;0.0;820.0;"<a href=""http://twitter.com"" rel=""nofollow"">Twitter Web Client</a>";Sign @OFA's petition to let the Senate know you demand a fair Supreme Court nomination process: https://t.co/PlX9s74RIs;0.6597;['lands', 'WhiteHouse', 'news']
